{
  "access_token": "eyJhbGciOiJFUzI1NiIsImtpZCI6ImtpZC0xIn0.eyJzdWIiOiJ1c2VyLTEifQ.signature",
  "token_type": "Bearer",
  "expires_in": 300,
  "scope": "read write",
  "issued_token_type": "urn:ietf:params:oauth:token-type:access_token",
  "target_resources": ["resource://api"],
  "upstreams": {
    "resource://api": {
      "url": "https://api.example.com",
      "auth_mode": "provider_oauth",
      "auth_header": "Authorization",
      "auth_scheme": "Bearer",
      "provider_token": "opaque-provider-token",
      "provider_id": "provider-1",
      "grant_id": "grant-1",
      "forward_caracal_identity": true,
      "expires_at": 1790000300
    }
  }
}
